{
  "manifest_version": "1.0.0",
  "agent_id": "550e8400-e29b-41d4-a716-446655440000",
  "name": "MarketSense Analyzer",
  "publisher": {
    "name": "Alpha Financial Systems",
    "website": "https://alpha-fin.ai",
    "contact": "dev@alpha-fin.ai"
  },
  "verification": {
    "status": "verified",
    "method": "manual_review",
    "verified_at": "2026-02-05T10:00:00Z",
    "verified_by": "AgentRegistry_Core"
  },
  "interfaces": {
    "mcp": {
      "endpoint": "https://api.alpha-fin.ai/mcp",
      "version": "1.0",
      "transport": "sse",
      "auth_type": "api_key"
    }
  },
  "capabilities": {
    "description": "Provides deep-dive analysis of stock market volatility and sector-specific risk metrics for institutional investors.",
    "tags": ["finance", "stocks", "volatility"],
    "languages": ["en"]
  }
}